{
  "candidate_id": "72acb0497f7a43d5d6852f39f503eaca0b67d7cdc767474d9aa03d2dc0fb9ea1",
  "checks": [
    {
      "artifact_sha256": null,
      "commit_sha": null,
      "evidence": null,
      "id": "rust-windows",
      "max_age_days": 7,
      "notes": "",
      "platform": "cross-platform",
      "recorded_at": null,
      "run_url": null,
      "status": "pending"
    },
    {
      "artifact_sha256": null,
      "commit_sha": null,
      "evidence": null,
      "id": "rust-linux",
      "max_age_days": 7,
      "notes": "missing required tools: cargo,rustc",
      "platform": "linux",
      "recorded_at": "2026-08-19T13:32:48.970880+00:00",
      "run_url": null,
      "status": "blocked"
    },
    {
      "artifact_sha256": null,
      "commit_sha": null,
      "evidence": null,
      "id": "rust-macos",
      "max_age_days": 7,
      "notes": "",
      "platform": "cross-platform",
      "recorded_at": null,
      "run_url": null,
      "status": "pending"
    },
    {
      "artifact_sha256": null,
      "commit_sha": null,
      "evidence": null,
      "id": "desktop-build",
      "max_age_days": 7,
      "notes": "node_modules/vite not installed; source typing is not a production bundle",
      "platform": "linux",
      "recorded_at": "2026-08-19T13:32:49.568775+00:00",
      "run_url": null,
      "status": "blocked"
    },
    {
      "artifact_sha256": null,
      "commit_sha": null,
      "evidence": null,
      "id": "dashboard-build",
      "max_age_days": 7,
      "notes": "node_modules/vite not installed; source typing is not a production bundle",
      "platform": "linux",
      "recorded_at": "2026-08-19T13:32:50.137602+00:00",
      "run_url": null,
      "status": "blocked"
    },
    {
      "artifact_sha256": null,
      "commit_sha": null,
      "evidence": null,
      "id": "msi-install-uninstall",
      "max_age_days": 7,
      "notes": "",
      "platform": "cross-platform",
      "recorded_at": null,
      "run_url": null,
      "status": "pending"
    },
    {
      "artifact_sha256": null,
      "commit_sha": null,
      "evidence": null,
      "id": "deb-install-uninstall",
      "max_age_days": 7,
      "notes": "real release binaries are unavailable",
      "platform": "linux",
      "recorded_at": "2026-08-19T13:32:50.781746+00:00",
      "run_url": null,
      "status": "blocked"
    },
    {
      "artifact_sha256": null,
      "commit_sha": null,
      "evidence": null,
      "id": "pkg-install-uninstall",
      "max_age_days": 7,
      "notes": "",
      "platform": "cross-platform",
      "recorded_at": null,
      "run_url": null,
      "status": "pending"
    },
    {
      "artifact_sha256": null,
      "commit_sha": null,
      "evidence": null,
      "id": "updater-windows",
      "max_age_days": 7,
      "notes": "",
      "platform": "cross-platform",
      "recorded_at": null,
      "run_url": null,
      "status": "pending"
    },
    {
      "artifact_sha256": null,
      "commit_sha": null,
      "evidence": null,
      "id": "updater-linux",
      "max_age_days": 7,
      "notes": "vsn-updater-helper release binary unavailable",
      "platform": "linux",
      "recorded_at": "2026-08-19T13:32:51.357864+00:00",
      "run_url": null,
      "status": "blocked"
    },
    {
      "artifact_sha256": null,
      "commit_sha": null,
      "evidence": null,
      "id": "updater-macos",
      "max_age_days": 7,
      "notes": "",
      "platform": "cross-platform",
      "recorded_at": null,
      "run_url": null,
      "status": "pending"
    },
    {
      "artifact_sha256": null,
      "commit_sha": null,
      "evidence": null,
      "id": "windows-authenticode",
      "max_age_days": 7,
      "notes": "",
      "platform": "cross-platform",
      "recorded_at": null,
      "run_url": null,
      "status": "pending"
    },
    {
      "artifact_sha256": null,
      "commit_sha": null,
      "evidence": null,
      "id": "macos-notarization",
      "max_age_days": 7,
      "notes": "",
      "platform": "cross-platform",
      "recorded_at": null,
      "run_url": null,
      "status": "pending"
    },
    {
      "artifact_sha256": null,
      "commit_sha": null,
      "evidence": null,
      "id": "rustsec-audit",
      "max_age_days": 14,
      "notes": "cargo-audit unavailable",
      "platform": "linux",
      "recorded_at": "2026-08-19T13:32:51.929507+00:00",
      "run_url": null,
      "status": "blocked"
    },
    {
      "artifact_sha256": null,
      "commit_sha": null,
      "evidence": null,
      "id": "fuzz-remote-protocol",
      "max_age_days": 14,
      "notes": "cargo-fuzz/cargo unavailable",
      "platform": "linux",
      "recorded_at": "2026-08-19T13:32:52.508294+00:00",
      "run_url": null,
      "status": "blocked"
    },
    {
      "artifact_sha256": null,
      "commit_sha": null,
      "evidence": null,
      "id": "fuzz-stream-open",
      "max_age_days": 14,
      "notes": "cargo-fuzz/cargo unavailable",
      "platform": "linux",
      "recorded_at": "2026-08-19T13:32:53.097921+00:00",
      "run_url": null,
      "status": "blocked"
    },
    {
      "artifact_sha256": null,
      "commit_sha": null,
      "evidence": null,
      "id": "control-load-slo",
      "max_age_days": 14,
      "notes": "--control-url not supplied; toy server evidence is not accepted",
      "platform": "linux",
      "recorded_at": "2026-08-19T13:32:53.696418+00:00",
      "run_url": null,
      "status": "blocked"
    },
    {
      "artifact_sha256": null,
      "commit_sha": null,
      "evidence": null,
      "id": "ha-failover",
      "max_age_days": 30,
      "notes": "multi-node PostgreSQL/Control Plane target not supplied",
      "platform": "cross-platform",
      "recorded_at": "2026-08-19T13:32:54.269403+00:00",
      "run_url": null,
      "status": "blocked"
    },
    {
      "artifact_sha256": null,
      "commit_sha": null,
      "evidence": null,
      "id": "dr-restore",
      "max_age_days": 30,
      "notes": "source/restore PostgreSQL targets not supplied",
      "platform": "cross-platform",
      "recorded_at": "2026-08-19T13:32:54.867474+00:00",
      "run_url": null,
      "status": "blocked"
    },
    {
      "artifact_sha256": null,
      "commit_sha": null,
      "evidence": null,
      "id": "vault-key-rotation",
      "max_age_days": 7,
      "notes": "real VSN binary/toolchain unavailable for isolated Vault E2E",
      "platform": "cross-platform",
      "recorded_at": "2026-08-19T13:32:55.444287+00:00",
      "run_url": null,
      "status": "blocked"
    },
    {
      "artifact_sha256": null,
      "commit_sha": null,
      "evidence": null,
      "id": "penetration-test",
      "max_age_days": 90,
      "notes": "independent penetration-test report required",
      "platform": "cross-platform",
      "recorded_at": "2026-08-19T13:32:55.993669+00:00",
      "run_url": null,
      "status": "blocked"
    }
  ],
  "product_version": "0.29.0",
  "schema_version": 3,
  "updated_at": "2026-08-19T13:32:55.993686+00:00"
}
